{
  "schemaVersion": "finance-cashflow-facts.v0.1",
  "section": "ANALYSIS",
  "period": "2026-08",
  "currency": "CNY",
  "coverage": "OWN_BANK_BOOKED_WITH_CATEGORIES",
  "totals": {
    "income": "10000.00",
    "expense": "1000.50",
    "netCashflow": "8999.50"
  },
  "categories": [
    {
      "name": "synthetic",
      "totals": {
        "income": "10000.00",
        "expense": "1000.50",
        "netCashflow": "8999.50"
      },
      "transactionCount": 4,
      "classificationVersion": "classification-v1"
    }
  ],
  "trend": [
    {
      "period": "2026-03",
      "totals": {
        "income": "10000.00",
        "expense": "1250.50",
        "netCashflow": "8749.50"
      }
    },
    {
      "period": "2026-04",
      "totals": {
        "income": "10000.00",
        "expense": "1250.50",
        "netCashflow": "8749.50"
      }
    },
    {
      "period": "2026-05",
      "totals": {
        "income": "10000.00",
        "expense": "1250.50",
        "netCashflow": "8749.50"
      }
    },
    {
      "period": "2026-06",
      "totals": {
        "income": "10000.00",
        "expense": "1250.50",
        "netCashflow": "8749.50"
      }
    },
    {
      "period": "2026-07",
      "totals": {
        "income": "10000.00",
        "expense": "1250.50",
        "netCashflow": "8749.50"
      }
    },
    {
      "period": "2026-08",
      "totals": {
        "income": "10000.00",
        "expense": "1000.50",
        "netCashflow": "8999.50"
      }
    }
  ],
  "source": {
    "namespace": "non-ai-banking",
    "subjectRef": "synthetic-customer-a",
    "system": "controlled-bank",
    "recordVersion": "spending-analysis-v1",
    "asOf": "2026-09-01T01:00:00Z",
    "observedAt": "2026-09-02T00:00:00Z",
    "policyRef": "D05-003-SUMMARY-GOVERNANCE",
    "policyAsOf": "2026-09-01T01:00:00Z"
  },
  "gaps": [
    "OTHER_BANKS_AND_CURRENCIES_NOT_COVERED",
    "CREDIT_CARD_BILLS_NOT_ADDED_TO_CASHFLOW"
  ]
}
